{
  "schemaVersion": "nmw-design/1",
  "theme": "pacific",
  "asset": {
    "collection": "nouns-cc0-local-seed",
    "sourceCommit": "2213eea1c15f331f786784c2621d53bdecf907e2",
    "sourceSha256": "a03f22b7838b35fdf0332617c9b8e2b032eb26cf1632afbefb200fec64c4bc20",
    "seed": {
      "background": 0,
      "body": 1,
      "accessory": 70,
      "head": 19,
      "glasses": 15
    }
  },
  "colors": {
    "paper": "#f4ecd8",
    "ink": "#3c3024",
    "accent": "#345b46"
  },
  "edition": {
    "label": "FIRST IMPRESSIONS",
    "number": 1
  },
  "specimen": {
    "algorithm": "sha256-canonical-v1-48",
    "id": "NMW1-3BE4CF28E31A"
  }
}
